{
  "$schema": "../profile.schema.json",
  "name": "Panthea EU",
  "identity": "8CE646C2F8F60AF7",
  "website": "https://www.panthea.eu",
  "description": {
    "overview": "Secure and reliable EU based validator operations.",
    "team": "",
    "security": ""
  },
  "contacts": {
    "telephone": "",
    "email": "validator@panthea.eu",
    "telegram": "PantheaEU",
    "twitter": "PantheaEU",
    "discord": "",
    "others": {
      "emergency": ""
    }
  }
}
